{
  "$schema": "./product.schema.json",
  "id": "video-creation",
  "displayName": "视频创作",
  "command": "video-creation",
  "packageName": "@desirecore-agent/video-creation",
  "homepage": "https://github.com/desirecore-agent/video-creation",
  "sourceUrl": "https://github.com/desirecore-agent/video-creation",
  "releasesUrl": "https://github.com/desirecore-agent/video-creation/releases",
  "upstreamUrl": "https://github.com/openfilm/openfilm",
  "examplesUrl": "https://github.com/openfilm/examples",
  "dataDirectory": ".video-creation",
  "libraryDirectory": "VideoCreation",
  "healthProduct": "video-creation-studio",
  "managedUpdates": true,
  "desktopPromotion": false,
  "desktop": {
    "updates": ""
  },
  "directorName": "视频导演"
}
